{
  "schema_version": "2.3",
  "source_id": "efs_01J00000000000000000000008",
  "source_revision": 1,
  "source_type": "repository-history",
  "issuer": {
    "kind": "integration",
    "name": "repository-export",
    "version": "2",
    "model": null
  },
  "origin": "file:authority/repository-history.json",
  "schema_uri": "https://example.org/repository-history.schema.json",
  "schema_version_declared": "1.0",
  "subject_scope": {
    "root": ".",
    "include": [
      "authorities/**",
      "references/**"
    ],
    "exclude": [],
    "description": "Source history relevant to the workflow"
  },
  "fact_scope": [
    "path occupancy",
    "revision timestamp",
    "commit identity"
  ],
  "effective_interval": {
    "start": "2026-07-01T00:00:00Z",
    "end": null
  },
  "readable_representation": "authority/REPOSITORY_HISTORY.md",
  "machine_representation": "authority/repository-history.json",
  "content_digest": "sha256:bbbbbbbbbbbbbbbbbbbbbbbbbbbbbbbbbbbbbbbbbbbbbbbbbbbbbbbbbbbbbbbb",
  "limitations": [
    "Does not observe virtual chat outputs."
  ],
  "handling_labels": [
    "internal"
  ],
  "license_expression": "Proprietary",
  "reuse_restrictions": [
    "Do not disclose source content outside the project."
  ],
  "created_at": "2026-07-15T12:05:00Z",
  "supersedes_source_revision_ref": null
}
